{
  "chunk_ids_sha256": "49dd89dd63c8b30f66742cfe573fe3a195b1a4b2990f68c12a6d31dc299b7e70",
  "collection_name": "nexodocs_chunks_v1",
  "distance": "Cosine",
  "documents": [
    {
      "chunk_count": 8,
      "document_id": "NSI-POL-OPS-001",
      "source_sha256": "d91f0dc00a417155ffa9b9cf1255ea887371eebf7478042e948c553f11c9a072"
    },
    {
      "chunk_count": 8,
      "document_id": "NSI-POL-PEO-001",
      "source_sha256": "224c2925f1040ce09298feffcaac05da3091538ceda4434f4ed9e40189380948"
    },
    {
      "chunk_count": 8,
      "document_id": "NSI-POL-PRV-001",
      "source_sha256": "d48427768a63dc35139b01d4d9c809c796f7472fd39cdff2a68fd8bef2071e3c"
    },
    {
      "chunk_count": 12,
      "document_id": "NSI-TAB-COV-001",
      "source_sha256": "abaea0da0ac519d03840e371b0598fc66cd3900ee8919a1c0c50def2c9e5b407"
    },
    {
      "chunk_count": 8,
      "document_id": "NSI-TAB-DIR-001",
      "source_sha256": "65594663aadc9a01c3305e8892b55ad02d29cfdda46ecf651237ea211053490b"
    }
  ],
  "embedding_dimensions": 1536,
  "embedding_model": "text-embedding-3-small",
  "embedding_provider": "openai",
  "payload_schema_version": "1.0",
  "plan_version": "1.0.0",
  "point_id_strategy": "uuid5-nexodocs-chunk-id",
  "points": [
    {
      "chunk_id": "nsi-chk-d74a870aa98d53559ff2d989",
      "document_id": "NSI-POL-OPS-001",
      "payload_sha256": "5ca9658a8583d8593fca8ccee7fffac3e8063270344a47657b989eb0063f2cf2",
      "point_id": "01cfcb23-7c34-5df4-9ab1-58fb167e66e8",
      "text_sha256": "f5c0ffedf1da61db86d833ccf61d618d851df2b8a5c487fff3da6249d7d3cf6c"
    },
    {
      "chunk_id": "nsi-chk-a4050c068fdb897db1ea291a",
      "document_id": "NSI-POL-OPS-001",
      "payload_sha256": "f19c9d755ec8b72745afe67c57f6b2d085f57d35fb993beba811b9285e9645f8",
      "point_id": "092c2478-9c65-57cf-9969-124a2176eeb9",
      "text_sha256": "52bb879d1da076057f69f8ec2fbe6f4c6380d0df76385802241fd22c92932733"
    },
    {
      "chunk_id": "nsi-chk-e5edfaef86e24204a29b2ca8",
      "document_id": "NSI-POL-OPS-001",
      "payload_sha256": "b5cecbee1d92eff9215686d5f908b114cc00594f421ababaeafd212f859d9eca",
      "point_id": "725712a5-a9d4-55cb-8cc6-a0685a81dfe6",
      "text_sha256": "c8b9603f699f7388d6d21f0b600a0e71dc75143eb1af412d91011fcea073a5ed"
    },
    {
      "chunk_id": "nsi-chk-d5f7526b615d51c8090d1e3a",
      "document_id": "NSI-POL-OPS-001",
      "payload_sha256": "358b04b35f40e0f9be9dfb8dc9ceaf65900918b25bf58c78e56df62662fb0fb8",
      "point_id": "bfa7b6ac-7220-5651-bdfb-1a53e9deded0",
      "text_sha256": "ef0cf5d8e350e4e42bb0245b7381f2ee85fcb9736d3259810117688ff75bfe07"
    },
    {
      "chunk_id": "nsi-chk-0c774dace3fe3952cfbe002c",
      "document_id": "NSI-POL-OPS-001",
      "payload_sha256": "f2fd5ae991e36449f9e76e4b8bf06cc2911d33f0465a3c4806c9ba4b1204f6d0",
      "point_id": "660d7286-e0a8-52fb-8c39-e40b23b84e3c",
      "text_sha256": "54e42b067aecaedd0f102e5f024c90a2370e6be1dfc211b31146112635f810fe"
    },
    {
      "chunk_id": "nsi-chk-1864514bf23eac2a3c92c998",
      "document_id": "NSI-POL-OPS-001",
      "payload_sha256": "4a6e0d10395012d0695b1e4a5f1c267e228f1a4b6aa84d49c35c2c04543315bd",
      "point_id": "77427cdd-544f-5398-9caf-e0ba48e28c36",
      "text_sha256": "24768fa477f001e369740758039e6ed4ecbf44a0094b465357b804f3bd1a0e87"
    },
    {
      "chunk_id": "nsi-chk-69a386d85c5a42817d2c0bca",
      "document_id": "NSI-POL-OPS-001",
      "payload_sha256": "9185149251fe139e43c5ebd2d3d4a87174ac61652fb292197d84c24c880b0744",
      "point_id": "29019755-5e2a-5892-bd8e-d6bb81c8a0dd",
      "text_sha256": "0d2d30b302046b7f67d621b4fa9423ee84499972e136e9959293b0d9524eaa47"
    },
    {
      "chunk_id": "nsi-chk-89c6c70a09012b7ebc9e89e5",
      "document_id": "NSI-POL-OPS-001",
      "payload_sha256": "e47a82d164321ba4aab861161d6d31e6238dacd9341152969569cf40713666fe",
      "point_id": "248a670d-47ae-507b-bb23-2ca35ca3863c",
      "text_sha256": "f7360223d0a81308b1482544a4c6f83068e92a68b2c063b2190d4d5d7869b3df"
    },
    {
      "chunk_id": "nsi-chk-a4ee5e1aea0dc048c4ae69c4",
      "document_id": "NSI-POL-PEO-001",
      "payload_sha256": "a67c9c858a7e5199892e3812ac9f12948b42eb77db8756a6b3e75ea1351a4b9e",
      "point_id": "da82fb25-f612-59fb-a1d0-f6563c9b2e01",
      "text_sha256": "08b39729ce400ef4e3874f1bac49b7ac1d25dea3fbe0acd67a6ba134b66fc606"
    },
    {
      "chunk_id": "nsi-chk-2436ea3761a30a92acf801ab",
      "document_id": "NSI-POL-PEO-001",
      "payload_sha256": "90c45e4e2f7188709141ecb5b3f084df13464156f90863c3d1ecaab8cf7d58f5",
      "point_id": "d5247bd2-0acf-5db7-9bff-c956346980a0",
      "text_sha256": "c8d111101ae57755d7a8fc24a669bde89b0aa236d9a2ad7a4b283e60a8a1710a"
    },
    {
      "chunk_id": "nsi-chk-f29bf2803f3918e8e1b2fa68",
      "document_id": "NSI-POL-PEO-001",
      "payload_sha256": "1a13f395b70ed5c6b4fc45c6b0de153198402c66ff9f7e2e4230c9aecb4cd266",
      "point_id": "be00d9f4-2557-5097-aaf5-2c44dd98a34f",
      "text_sha256": "1009821636ecadabb7159afd3fb2eed2f1522a457a6b781140a99604e4a4366c"
    },
    {
      "chunk_id": "nsi-chk-bcd2a79cb2231b9a9904047f",
      "document_id": "NSI-POL-PEO-001",
      "payload_sha256": "b0dd203140d0a901c5e7e0fd81958de5430677c2b13b2b0f5e94e49defca17d5",
      "point_id": "e5a9f192-6170-571f-a7c0-f98769f1068f",
      "text_sha256": "b3e8d4efc26b460fd1b3a3f1da53f76ce59009df9dd5dcb8f0397dd07b3079ed"
    },
    {
      "chunk_id": "nsi-chk-0a1d1dd8522c0f8729437e5b",
      "document_id": "NSI-POL-PEO-001",
      "payload_sha256": "4530f0fe3d101bd970e64bce8607818db4f132754e8fa982480fba34fddbdee2",
      "point_id": "56c7563f-346b-578c-976d-91839dcaf951",
      "text_sha256": "bebc0f1b012be1d53997179d8f5ba1b7baf8bcbc06d83317861b3e60e5845048"
    },
    {
      "chunk_id": "nsi-chk-618d89a2a097a876c14f8188",
      "document_id": "NSI-POL-PEO-001",
      "payload_sha256": "53e3f3fa64d7f2268288a4277e7e1b38ad49d0a5e46d4caeedb7a4aa61930e0e",
      "point_id": "a94d0815-a131-5462-b0e9-6f4471b39929",
      "text_sha256": "e630924e5368d2b0ee7f3d990ebf7b877c115296957c640ce3f6dd9f23e372a5"
    },
    {
      "chunk_id": "nsi-chk-787a6e804510939de57a7899",
      "document_id": "NSI-POL-PEO-001",
      "payload_sha256": "a9582b9bda4721ceaa217098cfe3b4e024fe1b8220158b50dff7d754841888c8",
      "point_id": "3fbf9063-009c-5917-96c3-65febe2b0f49",
      "text_sha256": "19ca43f7e7ff7b6f1990945620b36511c51a06426e078620595ffdbb146bb4f8"
    },
    {
      "chunk_id": "nsi-chk-4b960a5742854551d2ab7544",
      "document_id": "NSI-POL-PEO-001",
      "payload_sha256": "efeed936282e80dd2fe4c0da2d04118268bd89f65e2db20e2de3c40d3bf48066",
      "point_id": "27b73da0-c5af-5864-b416-e3164c20a292",
      "text_sha256": "08c6574d5a2cf6dd8e11b699fb970e348f1dc37456cc730edb04c2a7b6b41a17"
    },
    {
      "chunk_id": "nsi-chk-9e22b7d55629ed9f43f3d40c",
      "document_id": "NSI-POL-PRV-001",
      "payload_sha256": "a9f22a64b2c110d81fb17e6dbf5765f15a9350ae382b6686b3004e1b53be1d63",
      "point_id": "2a8923be-e86d-55d0-8dc6-17735250c263",
      "text_sha256": "e1482849e25bc5e6bf831519300fece8099e44875d7a0eeab975794df2d7e606"
    },
    {
      "chunk_id": "nsi-chk-c48c4cadfc4ce10dc005efd6",
      "document_id": "NSI-POL-PRV-001",
      "payload_sha256": "45f16309ff0d9e3ff1350498463d322e71043154e29d7a4303884b011864e10d",
      "point_id": "7d4b8dd7-fe8c-5cf1-b077-8e9381b427c4",
      "text_sha256": "2a47737019db4c924741d1d154ea0c8178af3175e7a1c6756029c651927b5475"
    },
    {
      "chunk_id": "nsi-chk-8d8e0c91e19851d460b03a08",
      "document_id": "NSI-POL-PRV-001",
      "payload_sha256": "c296e91ccd8fa7bcba8e197da99391f1368c4f0c43699df7b97f0c5a3886b846",
      "point_id": "bacdd0e1-05a0-589e-8ddc-c752b1d81eb3",
      "text_sha256": "c016dd3b5fb05c07448e907e180ba7b9f0f7cc7b365453380c7c570436070e24"
    },
    {
      "chunk_id": "nsi-chk-c6ba1b5748429a103d348ee5",
      "document_id": "NSI-POL-PRV-001",
      "payload_sha256": "148f185058e31b28be286fb1e0b76e172b6ced952d95735ed1a98ec4b538051f",
      "point_id": "b4381f18-8d31-54cb-a5db-775d442ef1f1",
      "text_sha256": "7fd4c93e2de28bc66013208e43c4dbbb63ac565b5a3e1373123f31780f8a4df3"
    },
    {
      "chunk_id": "nsi-chk-7cb8f5b08dddf1f523778f05",
      "document_id": "NSI-POL-PRV-001",
      "payload_sha256": "ab818a218982d36369614fcf1b4fa6f977afd49fc259a22e389753f13370e644",
      "point_id": "a9044920-63da-531c-9a26-a5842d80e2b8",
      "text_sha256": "21baf56242425f0ae56b0cdeadccbef3e50d49cc5ccd8b922f8e98848cd044b4"
    },
    {
      "chunk_id": "nsi-chk-6df0196daf7fd7eb9ecf1180",
      "document_id": "NSI-POL-PRV-001",
      "payload_sha256": "0a6ff49b823318d52994cae1aa0d5b0fc8206bd4171f296d1f7d57df3bd1ceb0",
      "point_id": "cd68fb6a-eb34-53dd-905f-24f164cba403",
      "text_sha256": "14778a13fe538ab53ac83ff0b3f29014ee3c2751b7dd561de0799fa47994a6f2"
    },
    {
      "chunk_id": "nsi-chk-34440f6e59145f210ca5585e",
      "document_id": "NSI-POL-PRV-001",
      "payload_sha256": "298d2af8ebc0caa11a4a741de7381e7e64cdfe0266564c669a3d6c5909539aa0",
      "point_id": "282b39ce-82c8-5dc3-ba9d-d484500a5891",
      "text_sha256": "d904bab3fce9b0de7c92a1842f5f38aa9a56029b87e1fcb973bd1f3a614857a2"
    },
    {
      "chunk_id": "nsi-chk-7ddfd09f0c29c8ae6958863b",
      "document_id": "NSI-POL-PRV-001",
      "payload_sha256": "8fd5128218237536f97e8c0776900d53adf5d163dbb788e798f6b8f0701b0c55",
      "point_id": "66ea34df-7eca-5cd4-ac08-e0e2da32303e",
      "text_sha256": "ab460a0cd3622393ccc8a1775d8f76d09d8d64a75cdd1b05380bb2c47ba48d49"
    },
    {
      "chunk_id": "nsi-chk-992852066102ac0247306d95",
      "document_id": "NSI-TAB-COV-001",
      "payload_sha256": "8a1110f3b85203f928811b97b469ad30df885edd66d1673434655bcf54fdcaff",
      "point_id": "3b74353a-69e0-59c9-8c8a-37e4b0dab2c0",
      "text_sha256": "c603bba8f0cb9c616b34708bcd5338d3c8e7c2673d1af68b1a1c86aee6045dbd"
    },
    {
      "chunk_id": "nsi-chk-66a326495048fb62c46e63a6",
      "document_id": "NSI-TAB-COV-001",